{"authority_required":["process:execute"],"build_provenance":{"builder":"github-reviewed-source","command":"git object d43372d7f6925845b903bf8c411ed1c5a1565e0c:tools/artifacts/pytest_runner.py"},"capabilities":[{"id":"run_tests","version":"1.0.0"}],"digest":{"algorithm":"sha256","value":"3737eba08a05b190f5049829eb3ab62d6a2c2cb91f0f253f7db58ebaa549594c"},"entrypoint":{"artifact":"tools/artifacts/pytest_runner.py","runtime":"python"},"health_check":["--version"],"implementation_id":"pytest_runner","license":"MIT","ports":{"inputs":["argv"],"outputs":["exit_code","stdout","stderr"]},"redistribution":"allowed","resource_budget":{"processes":1},"revocation_status":"valid","rollback":"Deactivate and remove the content-addressed cached artifact.","runtime_dependencies":["python>=3.12,<3.13","pytest"],"schema_version":"1.0.0","side_effects":[],"signature":{"key_id":"erasmus-release-2026-01","scheme":"ed25519","value":"JMZ6S2aAARwDjAFXnPKA8trEa6a3dLEFv65ZccEQeB2iJURO9cTBvHp7/KcViH2k6KzGGHK4/kazZZ8IMdiDDw=="},"source":{"commit":"d43372d7f6925845b903bf8c411ed1c5a1565e0c","repository":"https://github.com/HaggisSupper/erasmus-protomenta"},"target":"any-py3-none","timeout_seconds":600,"tool_id":"pytest_runner","version":"1.0.0"}
