{"authority_required":["database:read"],"build_provenance":{"builder":"github-reviewed-source","command":"git object d43372d7f6925845b903bf8c411ed1c5a1565e0c:tools/artifacts/sqlite_reader.py"},"capabilities":[{"id":"query_sqlite","version":"1.0.0"}],"digest":{"algorithm":"sha256","value":"ca75383ccfeb79013c052d00241ef7351518bfbf9999644859c73ca759366973"},"entrypoint":{"artifact":"tools/artifacts/sqlite_reader.py","runtime":"python"},"health_check":["--help"],"implementation_id":"sqlite_reader","license":"MIT","ports":{"inputs":["argv"],"outputs":["exit_code","stdout","stderr"]},"redistribution":"allowed","resource_budget":{"processes":1},"revocation_status":"valid","rollback":"Deactivate and remove the content-addressed cached artifact.","runtime_dependencies":["python>=3.12,<3.13"],"schema_version":"1.0.0","side_effects":[],"signature":{"key_id":"erasmus-release-2026-01","scheme":"ed25519","value":"aZtI5RkBVL3cnu85P0T5OPQc2reGcGzzVAVxZDHShphcVILVMJBReZX4pwkcucgq1pRBBV1cYx0f6Xct4E5yAA=="},"source":{"commit":"d43372d7f6925845b903bf8c411ed1c5a1565e0c","repository":"https://github.com/HaggisSupper/erasmus-protomenta"},"target":"any-py3-none","timeout_seconds":600,"tool_id":"sqlite_reader","version":"1.0.0"}
